tale_id,episode_id,sentence,num_words,num_clauses,dep_distance,Eventfulness,I,hurst_dep_distance,hurst_eventfulness,hurst_I
11,1,"In the evening they came to a great wood, and they were so weary with hunger and their long journey, that they climbed up into a high tree and fell asleep.",34,4,445,0.2,89.0,0.3626860424270672,0.9835058421140936,0.8184003971264262
11,2,"The next morning, when they awoke, the sun was high in heaven, and shone brightly through the leaves.",22,2,141,0.3333333333333333,47.0,0.3626860424270672,0.9835058421140936,0.8184003971264262
11,2,"Then said the brother, ""Sister, I am thirsty; if I only knew where to find a brook, that I might go and drink!",29,6,379,0.3333333333333333,126.33333333333331,0.3626860424270672,0.9835058421140936,0.8184003971264262
11,2,"I almost think that I hear one rushing.""",10,2,31,0.3333333333333333,10.333333333333332,0.3626860424270672,0.9835058421140936,0.8184003971264262
11,3,"So the brother got down and led his sister by the hand, and they went to seek the brook.",21,4,159,0.5,79.5,0.3626860424270672,0.9835058421140936,0.8184003971264262
11,3,"But their wicked stepmother was a witch, and had known quite well that the two children had run away, and had sneaked after them, as only witches can, and had laid a spell on all the brooks in the forest.",45,9,830,0.5,415.0,0.3626860424270672,0.9835058421140936,0.8184003971264262
11,4,"So when they found a little stream flowing smoothly over its pebbles, the brother was going to drink of it; but the sister heard how it said in its rushing, ""He a tiger will be who drinks of me, Who drinks of me a tiger will be!""",54,10,1281,1.0,1281.0,0.3626860424270672,0.9835058421140936,0.8184003971264262
11,5,"Then the sister cried, ""Pray, dear brother, do not drink, or you will become a wild beast, and will tear me in pieces.""",31,5,384,1.0,384.0,0.3626860424270672,0.9835058421140936,0.8184003971264262
11,6,"So the brother refrained from drinking, though his thirst was great, and he said he would wait till he came to the next brook.",27,5,282,0.5,141.0,0.3626860424270672,0.9835058421140936,0.8184003971264262
11,6,"When they came to a second brook the sister heard it say, ""He a wolf will be who drinks of me, Who drinks of me a wolf will be!""",34,7,499,0.5,249.5,0.3626860424270672,0.9835058421140936,0.8184003971264262
11,7,"Then the sister cried, ""Pray, dear brother, do not drink, or you will be turned into a wolf, and will eat me up!""",31,6,384,1.0,384.0,0.3626860424270672,0.9835058421140936,0.8184003971264262
11,8,"So the brother refrained from drinking, and said, ""I will wait until we come to the next brook, and then I must drink, whatever you say; my thirst is so great.""",39,7,636,1.0,636.0,0.3626860424270672,0.9835058421140936,0.8184003971264262
11,9,"And when they came to the third brook the sister heard how in its rushing it said, ""Who drinks of me a fawn will be, He a fawn will be who drinks of me!""",39,7,636,1.0,636.0,0.3626860424270672,0.9835058421140936,0.8184003971264262
11,10,"Then the sister said, ""O my brother, I pray drink not, or you will be turned into a fawn, and run away far from me.""",32,5,412,1.0,412.0,0.3626860424270672,0.9835058421140936,0.8184003971264262
11,11,"But he had already kneeled by the side of the brook and stooped and drunk of the water, and as the first drops passed his lips he became a fawn.",32,5,438,1.0,438.0,0.3626860424270672,0.9835058421140936,0.8184003971264262
11,12,"And the sister wept over her poor lost brother, and the fawn wept also, and stayed sadly beside her.",22,2,133,0.1428571428571428,19.0,0.3626860424270672,0.9835058421140936,0.8184003971264262
11,12,"At last the maiden said, ""Be comforted, dear fawn, indeed I will never leave you.""",21,3,146,0.1428571428571428,20.857142857142858,0.3626860424270672,0.9835058421140936,0.8184003971264262
11,12,"Then she untied her golden girdle and bound it round the fawn's neck, and went and gathered rushes to make a soft cord, which she fastened to him; and then she led him on, and they went deeper into the forest.",47,9,993,0.1428571428571428,141.85714285714286,0.3626860424270672,0.9835058421140936,0.8184003971264262
11,12,"And when they had gone a long long way, they came at last to a little house, and the maiden looked inside, and as it was empty she thought, ""We might as well live here.""",42,7,747,0.1428571428571428,106.71428571428572,0.3626860424270672,0.9835058421140936,0.8184003971264262
11,12,"And she fetched leaves and moss to make a soft bed for the fawn, and every morning she went out and gathered roots and berries and nuts for herself, and fresh grass for the fawn, who ate out of her hand with joy, frolicking round her.",51,5,1179,0.1428571428571428,168.42857142857142,0.3626860424270672,0.9835058421140936,0.8184003971264262
11,12,"At night, when the sister was tired, and had said her prayers, she laid her head on the fawn's back, which served her for a pillow, and softly fell asleep.",37,7,486,0.1428571428571428,69.42857142857143,0.3626860424270672,0.9835058421140936,0.8184003971264262
11,12,"And if only the brother could have got back his own shape again, it would have been a charming life.",22,4,141,0.1428571428571428,20.142857142857142,0.3626860424270672,0.9835058421140936,0.8184003971264262
11,13,So they lived a long while in the wilderness alone.,11,1,39,0.1,3.9,0.3626860424270672,0.9835058421140936,0.8184003971264262
11,13,Now it happened that the King of that country held a great hunt in the forest.,17,2,108,0.1,10.8,0.3626860424270672,0.9835058421140936,0.8184003971264262
11,13,"The blowing of the horns, the barking of the dogs, and the lusty shouts of the huntsmen sounded through the wood, and the fawn heard them and was eager to be among them.",37,4,343,0.1,34.300000000000004,0.3626860424270672,0.9835058421140936,0.8184003971264262
11,13,"""Oh,"" said he to his sister,"" do let me go to the hunt; I cannot stay behind any longer,"" and begged so long that at last she consented.",38,7,571,0.1,57.1,0.3626860424270672,0.9835058421140936,0.8184003971264262
11,13,"""But mind,"" said she to him,"" come back to me at night.",18,2,93,0.1,9.3,0.3626860424270672,0.9835058421140936,0.8184003971264262
11,13,"I must lock my door against the wild hunters, so, in order that I may know you, you must knock and say, ' Little sister, let me in,' and unless I hear that I shall not unlock the door.""",48,7,1038,0.1,103.8,0.3626860424270672,0.9835058421140936,0.8184003971264262
11,13,"Then the fawn sprang out, and felt glad and merry in the open air.",16,2,84,0.1,8.4,0.3626860424270672,0.9835058421140936,0.8184003971264262
11,13,"The King and his huntsmen saw the beautiful animal, and began at once to pursue him, but they could not come within reach of him, for when they thought they were certain of him he sprang away over the bushes and disappeared.",46,8,835,0.1,83.5,0.3626860424270672,0.9835058421140936,0.8184003971264262
11,13,"As soon as it was dark he went back to the little house, knocked at the door, and said, ""Little sister, let me in.""",31,5,361,0.1,36.1,0.3626860424270672,0.9835058421140936,0.8184003971264262
11,13,"Then the door was opened to him, and he went in, and rested the whole night long on his soft bed.",24,4,216,0.1,21.6,0.3626860424270672,0.9835058421140936,0.8184003971264262
11,14,"The next morning the hunt began anew, and when the fawn heard the hunting-horns and the tally-ho of the huntsmen he could rest no longer, and said, ""Little sister, let me out, I must go""",42,6,681,1.0,681.0,0.3626860424270672,0.9835058421140936,0.8184003971264262
11,15,"The sister opened the door and said, ""Now, mind you must come back at night and say the same words.""",25,4,256,0.2,51.2,0.3626860424270672,0.9835058421140936,0.8184003971264262
11,15,"When the King and his hunters saw the fawn with the golden collar again, they chased him closely, but he was too nimble and swift for them.",30,3,297,0.2,59.400000000000006,0.3626860424270672,0.9835058421140936,0.8184003971264262
11,15,"This lasted the whole day, and at last the hunters surrounded him, and one of them wounded his foot a little, so that he was obliged to limp and to go slowly.",36,7,596,0.2,119.2,0.3626860424270672,0.9835058421140936,0.8184003971264262
11,15,"Then a hunter slipped after him to the little house, and heard how he called out,"" Little sister, let me in,"" and saw the door open and shut again after him directly., The hunter noticed all this carefully, went to the King, and told him all he had seen and heard.",61,11,1659,0.2,331.8,0.3626860424270672,0.9835058421140936,0.8184003971264262
11,15,"Then said the King, ""To-morrow we will hunt again.""",13,2,67,0.2,13.4,0.3626860424270672,0.9835058421140936,0.8184003971264262
11,16,But the sister was very terrified when she saw that her fawn was wounded.,15,4,72,0.25,18.0,0.3626860424270672,0.9835058421140936,0.8184003971264262
11,16,"She washed his foot, laid cooling leaves round it, and said,"" Lie down on your bed, dear fawn, and rest, that you may be soon well.""",35,6,562,0.25,140.5,0.3626860424270672,0.9835058421140936,0.8184003971264262
11,16,"The wound was very slight, so that the fawn felt nothing of it the next morning.",18,2,123,0.25,30.75,0.3626860424270672,0.9835058421140936,0.8184003971264262
11,16,"And when he heard the noise of the hunting outside, he said, ""I cannot stay in, I must go after them; I shall not be taken easily again!""",36,6,534,0.25,133.5,0.3626860424270672,0.9835058421140936,0.8184003971264262
11,17,"The sister began to weep, and said, ""I know you will be killed, and I left alone here in the forest, and forsaken of everybody.",31,7,409,0.3333333333333333,136.33333333333331,0.3626860424270672,0.9835058421140936,0.8184003971264262
11,17,"I cannot let you go!""",8,2,16,0.3333333333333333,5.333333333333333,0.3626860424270672,0.9835058421140936,0.8184003971264262
11,17,"""Then I shall die here with longing,"" answered the fawn;"" when I hear the sound of the horn I feel as if I should leap out of my skin.""",36,5,506,0.3333333333333333,168.66666666666666,0.3626860424270672,0.9835058421140936,0.8184003971264262
11,18,"Then the sister, seeing there was no help for it, unlocked the door with a heavy heart, and the fawn bounded away into the forest, well and merry.",33,4,416,1.0,416.0,0.3626860424270672,0.9835058421140936,0.8184003971264262
11,19,"When the King saw him, he said to his hunters, ""Now, follow him up all day long till the night comes, and see that you do him no hurt.""",36,6,534,0.1,53.400000000000006,0.3626860424270672,0.9835058421140936,0.8184003971264262
11,19,"So as soon as the sun had gone down, the King said to the huntsmen:"" Now, come and show me the little house in the wood.""",32,5,346,0.1,34.6,0.3626860424270672,0.9835058421140936,0.8184003971264262
11,19,"And when he got to the door he knocked at it, and cried, ""Little sister, let me in!""",24,4,216,0.1,21.6,0.3626860424270672,0.9835058421140936,0.8184003971264262
11,19,"Then the door opened, and the King went in, and there stood a maiden more beautiful than any he had seen before.",25,5,237,0.1,23.700000000000003,0.3626860424270672,0.9835058421140936,0.8184003971264262
11,19,"The maiden shrieked out when she saw, instead of the fawn, a man standing there with a gold crown on his head.",25,3,256,0.1,25.6,0.3626860424270672,0.9835058421140936,0.8184003971264262
11,19,"But the King looked kindly on her, took her by the hand, and said, ""Will you go with me to my castle, and be my dear wife?""",34,5,471,0.1,47.1,0.3626860424270672,0.9835058421140936,0.8184003971264262
11,19,"""Oh yes,"" answered the maiden, ""but the fawn must come too.",17,2,81,0.1,8.1,0.3626860424270672,0.9835058421140936,0.8184003971264262
11,19,"I could not leave him.""",7,1,12,0.1,1.2000000000000002,0.3626860424270672,0.9835058421140936,0.8184003971264262
11,19,"And the King said, ""He shall remain with you as long as you live, and shall lack nothing.""",23,4,196,0.1,19.6,0.3626860424270672,0.9835058421140936,0.8184003971264262
11,19,"Then the fawn came bounding in, and the sister tied the cord of rushes to him, and led him by her own hand out of the little house.",31,4,384,0.1,38.400000000000006,0.3626860424270672,0.9835058421140936,0.8184003971264262
11,20,"The King put the beautiful maiden on his horse, and carried her to his castle, where the wedding was held with great pomp; so she became lady Queen, and they lived together happily for a long while; the fawn was well tended and cherished, and he gambolled about the castle garden.",58,10,1543,0.1,154.3,0.3626860424270672,0.9835058421140936,0.8184003971264262
11,20,"Now the wicked stepmother, whose fault it was that the children were driven out into the world, never dreamed but that the sister had been eaten up by wild beasts in the forest, and that the brother, in the likeness of a fawn, had been slain by the hunters.",55,10,1117,0.1,111.7,0.3626860424270672,0.9835058421140936,0.8184003971264262
11,20,"But when she heard that they were so happy, and that things had gone so well with them, jealousy and envy arose in her heart, and left her no peace, and her chief thought was how to bring misfortune upon them.",46,7,909,0.1,90.9,0.3626860424270672,0.9835058421140936,0.8184003971264262
11,20,"Her own daughter, who was as ugly as sin, and had only one eye, complained to her, and said, ""I never had the chance of being a Queen.""",36,6,480,0.1,48.0,0.3626860424270672,0.9835058421140936,0.8184003971264262
11,20,"""Never mind,"" said the old woman, to satisfy her;"" when the time comes, I shall be at hand.""",27,4,246,0.1,24.6,0.3626860424270672,0.9835058421140936,0.8184003971264262
11,20,"After a while the Queen brought a beautiful baby-boy into the world, and that day the King was out hunting.",22,2,151,0.1,15.1,0.3626860424270672,0.9835058421140936,0.8184003971264262
11,20,"The old witch took the shape of the bedchamber woman, and went into the room where the Queen lay, and said to her, ""Come, the bath is ready; it will give you refreshment and new strength.",43,6,786,0.1,78.60000000000001,0.3626860424270672,0.9835058421140936,0.8184003971264262
11,20,"Quick, or it will be cold.""",9,1,21,0.1,2.1,0.3626860424270672,0.9835058421140936,0.8184003971264262
11,20,"Her daughter was within call, so they carried the sick Queen into the bath-room, and left her there.",21,3,174,0.1,17.400000000000002,0.3626860424270672,0.9835058421140936,0.8184003971264262
11,20,"And in the bath-room they had made a great fire, so as to suffocate the beautiful young Queen.",20,3,120,0.1,12.0,0.3626860424270672,0.9835058421140936,0.8184003971264262
11,21,"When that was managed, the old woman took her daughter, put a cap on her, and laid her in the bed in the Queen's place, gave her also the Queen's form and countenance, only she could not restore the lost eye.",49,8,1084,0.2,216.8,0.3626860424270672,0.9835058421140936,0.8184003971264262
11,21,"So, in order that the King might not remark it, she had to lie on the side where there was no eye.",25,4,165,0.2,33.0,0.3626860424270672,0.9835058421140936,0.8184003971264262
11,21,"In the evening, when the King came home and heard that a little son was born to him, he rejoiced with all his heart, and was going at once to his dear wife's bedside to see how she did.",44,8,694,0.2,138.8,0.3626860424270672,0.9835058421140936,0.8184003971264262
11,21,"Then the old woman cried hastily, ""For your life, do not draw back the curtains, to let in the light upon her; she must be kept quiet.""",34,6,445,0.2,89.0,0.3626860424270672,0.9835058421140936,0.8184003971264262
11,21,"So the King went away, and never knew that a false Queen was lying in the bed.",19,4,126,0.2,25.200000000000003,0.3626860424270672,0.9835058421140936,0.8184003971264262
11,22,"Now, when it was midnight, and every one was asleep, the nurse, who was sitting by the cradle in the nursery and watching there alone, saw the door open, and the true Queen come in.",42,7,713,0.2,142.6,0.3626860424270672,0.9835058421140936,0.8184003971264262
11,22,"She took the child out of the cradle, laid it in her bosom, and fed it.",19,3,154,0.2,30.8,0.3626860424270672,0.9835058421140936,0.8184003971264262
11,22,"Then she shook out its little pillow, put the child back again, and covered it with the coverlet.",21,3,174,0.2,34.800000000000004,0.3626860424270672,0.9835058421140936,0.8184003971264262
11,22,"She did not forget the fawn either: she went to him where he lay in the corner, and stroked his back tenderly.",25,5,277,0.2,55.400000000000006,0.3626860424270672,0.9835058421140936,0.8184003971264262
11,22,"Then she went in perfect silence out at the door, and the nurse next morning asked the watchmen if any one had entered the castle during the night, but they said they had seen no one.",39,7,669,0.2,133.8,0.3626860424270672,0.9835058421140936,0.8184003971264262
11,23,"And the Queen came many nights, and never said a word; the nurse saw her always, but she did not dare speak of it to any one.",31,5,384,1.0,384.0,0.3626860424270672,0.9835058421140936,0.8184003971264262
11,24,"After some time had gone by in this manner, the Queen seemed to find voice, and said one night, ""My child my fawn twice more I come to see,Twice more I come, and then the end must be.""",47,9,952,1.0,952.0,0.3626860424270672,0.9835058421140936,0.8184003971264262
11,25,"The nurse said nothing, but as soon as the Queen had disappeared she went to the King and told him all.",23,5,213,0.2,42.6,0.3626860424270672,0.9835058421140936,0.8184003971264262
11,25,"The King said, ""Ah, heaven!",9,1,24,0.2,4.800000000000001,0.3626860424270672,0.9835058421140936,0.8184003971264262
11,25,what do I hear!,5,2,7,0.2,1.4,0.3626860424270672,0.9835058421140936,0.8184003971264262
11,25,"I will myself watch by the child to-morrow night.""",11,1,39,0.2,7.800000000000001,0.3626860424270672,0.9835058421140936,0.8184003971264262
11,25,"So at evening he went into the nursery, and at midnight the Queen appeared, and said, ""My child my fawn once more I come to see,Once more I come, and then the end must be.""",44,8,864,0.2,172.8,0.3626860424270672,0.9835058421140936,0.8184003971264262
11,26,"And she tended the child, as she was accustomed to do, before she vanished.",17,5,108,0.5,54.0,0.3626860424270672,0.9835058421140936,0.8184003971264262
11,26,"The King dared not speak to her, but he watched again the following night, and heard her say, ""My child my fawn this once I come to see,This once I come, and now the end must be.""",46,7,949,0.5,474.5,0.3626860424270672,0.9835058421140936,0.8184003971264262
11,27,"Then the King could contain himself no longer, but rushed towards her, saying, ""You are no other than my dear wife!""",27,4,263,1.0,263.0,0.3626860424270672,0.9835058421140936,0.8184003971264262
11,28,"Then she answered, ""Yes, I am your dear wife,"" and in that moment, by the grace of heaven, her life returned to her, and she was once more well and strong.",40,4,706,0.5,353.0,0.3626860424270672,0.9835058421140936,0.8184003971264262
11,28,Then she told the King the snare that the wicked witch and her daughter had laid for her.,19,3,139,0.5,69.5,0.3626860424270672,0.9835058421140936,0.8184003971264262
11,29,"The King had them both brought to judgment, and sentence was passed upon them.",16,4,94,0.3333333333333333,31.33333333333333,0.3626860424270672,0.9835058421140936,0.8184003971264262
11,29,"The daughter was sent away into the wood, where she was devoured by the wild beasts, and the witch was burned, and ended miserably.",28,7,328,0.3333333333333333,109.33333333333331,0.3626860424270672,0.9835058421140936,0.8184003971264262
11,29,"And as soon as her body was in ashes the spell was removed from the fawn, and he took human shape again; and then the sister and brother lived happily together until the end.",37,5,486,0.3333333333333333,162.0,0.3626860424270672,0.9835058421140936,0.8184003971264262
12,1,"One summer morning a little tailor was sitting on his board near the window, and working cheerfully with all his might, when an old woman came down the street crying, ""Good jelly to sell!",39,5,549,0.3333333333333333,183.0,0.6369788331712661,0.8447668002426469,0.8351309106277979
12,1,"good jelly to sell!""",6,1,9,0.3333333333333333,3.0,0.6369788331712661,0.8447668002426469,0.8351309106277979
12,1,"The cry sounded pleasant in the little tailor's ears, so he put his head out of the window, and called out, ""Here, my good woman, come here, if you want a customer.""",42,5,783,0.3333333333333333,261.0,0.6369788331712661,0.8447668002426469,0.8351309106277979
12,2,"So the poor woman climbed the steps with her heavy basket, and was obliged to unpack and display all her pots to the tailor.",26,5,241,0.25,60.25,0.6369788331712661,0.8447668002426469,0.8351309106277979
12,2,"He looked at every one of them, and lifting all the lids, applied his nose to each, and said at last, ""The jelly seems pretty good; you may weigh me out four half ounces, or I don't mind having a quarter of a pound.""",54,9,1379,0.25,344.75,0.6369788331712661,0.8447668002426469,0.8351309106277979
12,2,"The woman, who had expected to find a good customer, gave him what he asked for, but went off angry and grumbling.",26,6,241,0.25,60.25,0.6369788331712661,0.8447668002426469,0.8351309106277979
12,2,"""This jelly is the very thing for me,"" cried the little tailor; ""it will give me strength and cunning; ""and he took down the bread from the cupboard, cut a whole round of the loaf, and spread the jelly on it, laid it near him, and went on stitching more gallantly than ever.",65,9,1897,0.25,474.25,0.6369788331712661,0.8447668002426469,0.8351309106277979
12,3,"All the while the scent of the sweet jelly was spreading throughout the room, where there were quantities of flies, who were attracted by it and flew to partake.",32,7,298,0.0625,18.625,0.6369788331712661,0.8447668002426469,0.8351309106277979
12,3,"""Now then, who asked you to come?""",11,2,30,0.0625,1.875,0.6369788331712661,0.8447668002426469,0.8351309106277979
12,3,"said the tailor, and drove the unbidden guests away.",11,2,55,0.0625,3.4375,0.6369788331712661,0.8447668002426469,0.8351309106277979
12,3,"But the flies, not understanding his language, were not to be got rid of like that, and returned in larger numbers than before.",27,5,246,0.0625,15.375,0.6369788331712661,0.8447668002426469,0.8351309106277979
12,3,"Then the tailor, not being able to stand it any longer, took from his chimney-corner a ragged cloth, and saying, ""Now, I'll let you have it!""",35,6,450,0.0625,28.125,0.6369788331712661,0.8447668002426469,0.8351309106277979
12,3,beat it among them unmercifully.,6,1,15,0.0625,0.9375,0.6369788331712661,0.8447668002426469,0.8351309106277979
12,3,"When he ceased, and counted the slain, he found seven lying dead before him.",17,4,108,0.0625,6.75,0.6369788331712661,0.8447668002426469,0.8351309106277979
12,3,"""This is indeed somewhat,"" he said, wondering at his own gallantry; ""the whole town shall know this.""",25,4,256,0.0625,16.0,0.6369788331712661,0.8447668002426469,0.8351309106277979
12,3,"So he hastened to cut out a belt, and he stitched it^ and put on it in large capitals ""Seven at one blow!""",27,4,303,0.0625,18.9375,0.6369788331712661,0.8447668002426469,0.8351309106277979
12,3,"""The town, did I say!""",9,2,20,0.0625,1.25,0.6369788331712661,0.8447668002426469,0.8351309106277979
12,3,"said the little tailor; ""the whole world shall know it!""",14,2,91,0.0625,5.6875,0.6369788331712661,0.8447668002426469,0.8351309106277979
12,3,"And his heart quivered with joy, like a lamb's tail.",13,1,51,0.0625,3.1875,0.6369788331712661,0.8447668002426469,0.8351309106277979
12,3,"The tailor fastened the belt round him, and began to think of going out into the world, for his workshop seemed too small for his worship.",29,6,354,0.0625,22.125,0.6369788331712661,0.8447668002426469,0.8351309106277979
12,3,"So he looked about in all the house for something that it would be useful to take with him, but he found nothing but an old cheese, which he put in his pocket.",36,5,564,0.0625,35.25,0.6369788331712661,0.8447668002426469,0.8351309106277979
12,3,"Outside the door he noticed that a bird had got caught in the bushes, so he took that and put it in his pocket with the cheese.",29,6,310,0.0625,19.375,0.6369788331712661,0.8447668002426469,0.8351309106277979
12,3,"Then he set out gallantly on his way, and as he was light and active he felt no fatigue.",21,3,174,0.0625,10.875,0.6369788331712661,0.8447668002426469,0.8351309106277979
12,4,"The way led over a mountain, and when he reached the topmost peak he saw a terrible giant sitting there, and looking about him at his ease.",30,5,381,0.25,95.25,0.6369788331712661,0.8447668002426469,0.8351309106277979
12,4,"The tailor went bravely up to him, called out to him, and said, ""Comrade, good day!",22,3,193,0.25,48.25,0.6369788331712661,0.8447668002426469,0.8351309106277979
12,4,there you sit looking over the wide world!,9,2,24,0.25,6.0,0.6369788331712661,0.8447668002426469,0.8351309106277979
12,4,"I am on the way thither to seek my fortune: have you a fancy to go with me?""",21,4,191,0.25,47.75,0.6369788331712661,0.8447668002426469,0.8351309106277979
12,5,"The giant looked at the tailor contemptuously, and said, ""You little rascal!",16,2,94,0.1,9.4,0.6369788331712661,0.8447668002426469,0.8351309106277979
12,5,"you miserable fellow!""",5,1,10,0.1,1.0,0.6369788331712661,0.8447668002426469,0.8351309106277979
12,5,"- ""That may be!""",7,1,13,0.1,1.3,0.6369788331712661,0.8447668002426469,0.8351309106277979
12,5,"answered the little tailor, and undoing his coat he showed the giant his belt; ""you can read there whether I am a man or not!""",30,5,435,0.1,43.5,0.6369788331712661,0.8447668002426469,0.8351309106277979
12,5,"The giant read: ""Seven at one blow!""",11,1,55,0.1,5.5,0.6369788331712661,0.8447668002426469,0.8351309106277979
