tale_id,episode_id,sentence,num_words,num_clauses,dep_distance,Eventfulness,I,hurst_dep_distance,hurst_eventfulness,hurst_I
3,1,"So the father gave him his blessing, and with great sorrow took leave of him.",17,2,97,0.0625,6.0625,0.519173867423309,0.4623052039743207,0.8523598391077413
3,1,"At this time the King of a mighty empire was at war, and the youth took service with him, and with him went out to fight.",29,4,235,0.0625,14.6875,0.519173867423309,0.4623052039743207,0.8523598391077413
3,1,"And when he came before the enemy, there was a battle, and great danger, and it rained shot until his comrades fell on all sides, and when the leader also was killed, those left were about to take flight, but the youth stepped forth, spoke boldly to them, and cried, ""We will not let our fatherland be ruined!""",70,15,2217,0.0625,138.5625,0.519173867423309,0.4623052039743207,0.8523598391077413
3,1,"Then the others followed him, and he pressed on and conquered the enemy.",15,3,72,0.0625,4.5,0.519173867423309,0.4623052039743207,0.8523598391077413
3,1,"When the King heard that he owed the victory to him alone, he raised him above all the others, gave him great treasures, and made him the first in the kingdom.The King had a daughter who was very beautiful, but she was also very strange.",50,7,967,0.0625,60.4375,0.519173867423309,0.4623052039743207,0.8523598391077413
3,1,She had made a vow to take no one as her lord and husband who did not promise to let himself be buried alive with her if she died first.,31,9,436,0.0625,27.25,0.519173867423309,0.4623052039743207,0.8523598391077413
3,1,"""If he loves me with all his heart,"" said she, ""of what use will life be to him afterwards?""",26,3,259,0.0625,16.1875,0.519173867423309,0.4623052039743207,0.8523598391077413
3,1,"On her side she would do the same, and if he died first, would go down to the grave with him.",24,3,186,0.0625,11.625,0.519173867423309,0.4623052039743207,0.8523598391077413
3,1,"This strange oath had up to this time frightened away all wooers, but the youth became so charmed with her beauty that he cared for nothing, but asked her father for her.",35,5,502,0.0625,31.375,0.519173867423309,0.4623052039743207,0.8523598391077413
3,1,"""But dost thou know what thou must promise?""",11,2,31,0.0625,1.9375,0.519173867423309,0.4623052039743207,0.8523598391077413
3,1,said the King.,4,1,6,0.0625,0.375,0.519173867423309,0.4623052039743207,0.8523598391077413
3,1,"""I must be buried with her,"" he replied, ""if I outlive her, but my love is so great that I do not mind the danger.""",33,7,441,0.0625,27.5625,0.519173867423309,0.4623052039743207,0.8523598391077413
3,1,"Then the King consented, and the wedding was solemnized with great splendour.",14,3,61,0.0625,3.8125,0.519173867423309,0.4623052039743207,0.8523598391077413
3,2,"They lived now for a while happy and contented with each other, and then it befell that the young Queen was attacked by a severe illness, and no physician could save her.",35,6,562,0.25,140.5,0.519173867423309,0.4623052039743207,0.8523598391077413
3,2,"And as she lay there dead, the young King remembered what he had been obliged to promise, and was horrified at having to lie down alive in the grave, but there was no escape.",38,11,601,0.25,150.25,0.519173867423309,0.4623052039743207,0.8523598391077413
3,2,"The King had placed sentries at all the gates, and it was not possible to avoid his fate.",20,4,156,0.25,39.0,0.519173867423309,0.4623052039743207,0.8523598391077413
3,2,"When the day came when the corpse was to be buried, he was taken down into the royal vault with it and then the door was shut and bolted.",31,9,384,0.25,96.0,0.519173867423309,0.4623052039743207,0.8523598391077413
3,3,"Near the coffin stood a table on which were four candles, four loaves of bread, and four bottles of wine, and when this provision came to an end, he would have to die of hunger.",40,5,672,0.0666666666666666,44.8,0.519173867423309,0.4623052039743207,0.8523598391077413
3,3,"And now he sat there full of pain and grief, ate every day only a little piece of bread, drank only a mouthful of wine, and nevertheless saw death daily drawing nearer.",36,4,534,0.0666666666666666,35.6,0.519173867423309,0.4623052039743207,0.8523598391077413
3,3,"Whilst he thus gazed before him, he saw a snake creep out of a corner of the vault and approach the dead body.",25,3,237,0.0666666666666666,15.8,0.519173867423309,0.4623052039743207,0.8523598391077413
3,3,"And as he thought it came to gnaw at it, he drew his sword and said, ""As long as I live, thou shalt not touch her,"" and hewed the snake in three pieces.",40,8,672,0.0666666666666666,44.8,0.519173867423309,0.4623052039743207,0.8523598391077413
3,3,"After a time a second snake crept out of the hole, and when it saw the other lying dead and cut in pieces, it went back, but soon came again with three green leaves in its mouth.",41,7,616,0.0666666666666666,41.06666666666666,0.519173867423309,0.4623052039743207,0.8523598391077413
3,3,"Then it took the three pieces of the snake, laid them together, as they ought to go, and placed one of the leaves on each wound.",30,4,381,0.0666666666666666,25.4,0.519173867423309,0.4623052039743207,0.8523598391077413
3,3,"Immediately the severed parts joined themselves together, the snake moved, and became alive again, and both of them hastened away together.",25,4,220,0.0666666666666666,14.666666666666666,0.519173867423309,0.4623052039743207,0.8523598391077413
3,3,"The leaves were left lying on the ground, and a desire came into the mind of the unhappy man who had been watching all this, to know if the wondrous power of the leaves which had brought the snake to life again, could not likewise be of service to a human being.",56,13,1434,0.0666666666666666,95.6,0.519173867423309,0.4623052039743207,0.8523598391077413
3,3,"So he picked up the leaves and laid one of them on the mouth of his dead wife, and the two others on her eyes.",27,2,303,0.0666666666666666,20.2,0.519173867423309,0.4623052039743207,0.8523598391077413
3,3,"And hardly had he done this than the blood stirred in her veins, rose into her pale face, and coloured it again.",25,5,256,0.0666666666666666,17.066666666666666,0.519173867423309,0.4623052039743207,0.8523598391077413
3,3,"Then she drew breath, opened her eyes, and said, ""Ah, God, where am I?""",22,4,193,0.0666666666666666,12.866666666666667,0.519173867423309,0.4623052039743207,0.8523598391077413
3,3,"- ""Thou art with me, dear wife,"" he answered, and told her how everything had happened, and how he had brought her back again to life.",33,6,288,0.0666666666666666,19.2,0.519173867423309,0.4623052039743207,0.8523598391077413
3,3,"Then he gave her some wine and bread, and when she had regained her strength, he raised her up and they went to the door and knocked, and called so loudly that the sentries heard it, and told the King.",45,9,906,0.0666666666666666,60.4,0.519173867423309,0.4623052039743207,0.8523598391077413
3,3,"The King came down himself and opened the door, and there he found both strong and well, and rejoiced with them that now all sorrow was over.",30,5,381,0.0666666666666666,25.4,0.519173867423309,0.4623052039743207,0.8523598391077413
3,3,"The young King, however, took the three snake-leaves with him, gave them to a servant and said, ""Keep them for me carefully, and carry them constantly about thee; who knows in what trouble they may yet be of service to us!""",50,7,967,0.0666666666666666,64.46666666666667,0.519173867423309,0.4623052039743207,0.8523598391077413
3,4,"A change had, however, taken place in his wife; after she had been restored to life, it seemed as if all love for her husband had gone out of her heart.",36,8,564,0.1428571428571428,80.57142857142857,0.519173867423309,0.4623052039743207,0.8523598391077413
3,4,"After some time, when he wanted to make a voyage over the sea, to visit his old father, and they had gone on board a ship, she forgot the great love and fidelity which he had shown her, and which had been the means of rescuing her from death, and conceived a wicked inclination for the skipper.",64,12,1674,0.1428571428571428,239.14285714285717,0.519173867423309,0.4623052039743207,0.8523598391077413
3,4,"And once when the young King lay there asleep, she called in the skipper and seized the sleeper by the head, and the skipper took him by the feet, and thus they threw him down into the sea.",42,4,531,0.1428571428571428,75.85714285714285,0.519173867423309,0.4623052039743207,0.8523598391077413
3,4,"When the shameful deed was done, she said, ""Now let us return home, and say that he died on the way.",26,7,241,0.1428571428571428,34.42857142857142,0.519173867423309,0.4623052039743207,0.8523598391077413
3,4,"I will extol and praise thee so to my father that he will marry me to thee, and make thee the heir to his crown.""",28,5,328,0.1428571428571428,46.85714285714285,0.519173867423309,0.4623052039743207,0.8523598391077413
3,4,"But the faithful servant who had seen all that they did, unseen by them, unfastened a little boat from the ship, got into it, sailed after his master, and let the traitors go on their way.",42,8,681,0.1428571428571428,97.28571428571428,0.519173867423309,0.4623052039743207,0.8523598391077413
3,4,"He fished up the dead body, and by the help of the three snake-leaves which he carried about with him, and laid on the eyes and mouth, he fortunately brought the young King back to life.",40,4,742,0.1428571428571428,106.0,0.519173867423309,0.4623052039743207,0.8523598391077413
3,5,"They both rowed with all their strength day and night, and their little boat flew so swiftly that they reached the old King before the others did.",29,4,354,0.0769230769230769,27.230769230769237,0.519173867423309,0.4623052039743207,0.8523598391077413
3,5,"He was astonished when he saw them come alone, and asked what had happened to them.",18,7,137,0.0769230769230769,10.538461538461538,0.519173867423309,0.4623052039743207,0.8523598391077413
3,5,"When he learnt the wickedness of his daughter he said, ""I cannot believe that she has behaved so ill, but the truth will soon come to light,"" and bade both go into a secret chamber and keep themselves hidden from every one.",49,9,1084,0.0769230769230769,83.38461538461539,0.519173867423309,0.4623052039743207,0.8523598391077413
3,5,"Soon afterwards the great ship came sailing in, and the godless woman appeared before her father with a troubled countenance.",22,3,151,0.0769230769230769,11.615384615384617,0.519173867423309,0.4623052039743207,0.8523598391077413
3,5,"He said, ""Why dost thou come back alone?",11,2,46,0.0769230769230769,3.5384615384615388,0.519173867423309,0.4623052039743207,0.8523598391077413
3,5,"Where is thy husband?""",6,1,11,0.0769230769230769,0.8461538461538463,0.519173867423309,0.4623052039743207,0.8523598391077413
3,5,"- ""Ah, dear father,"" she replied, ""I come home again in great grief; during the voyage, my husband became suddenly ill and died, and if the good skipper had not given me his help, it would have gone ill with me.",52,9,1138,0.0769230769230769,87.53846153846155,0.519173867423309,0.4623052039743207,0.8523598391077413
3,5,"He was present at his death, and can tell you all.""",14,2,79,0.0769230769230769,6.0769230769230775,0.519173867423309,0.4623052039743207,0.8523598391077413
3,5,"The King said, ""I will make the dead alive again,"" and opened the chamber, and bade the two come out.",26,5,279,0.0769230769230769,21.461538461538463,0.519173867423309,0.4623052039743207,0.8523598391077413
3,5,"When the woman saw her husband, she was thunderstruck, and fell on her knees and begged for mercy.",21,5,159,0.0769230769230769,12.230769230769232,0.519173867423309,0.4623052039743207,0.8523598391077413
3,5,"The King said, ""There is no mercy.",10,2,31,0.0769230769230769,2.3846153846153846,0.519173867423309,0.4623052039743207,0.8523598391077413
3,5,"He was ready to die with thee and restored thee to life again, but thou hast murdered him in his sleep, and shalt receive the reward that thou deservest.""",33,7,497,0.0769230769230769,38.23076923076923,0.519173867423309,0.4623052039743207,0.8523598391077413
3,5,"Then she was placed with her accomplice in a ship which had been pierced with holes, and sent out to sea, where they soon sank amid the waves.",31,7,409,0.0769230769230769,31.461538461538463,0.519173867423309,0.4623052039743207,0.8523598391077413
4,1,"There was once on a time an old king who was ill, and thought to himself, ""I am lying on what must be my death-bed.""",30,6,407,0.0909090909090909,37.0,0.5539241658790723,0.6086882307266724,0.46138390235850835
4,1,"Then said he, "" Tell Faithful John to come to me.""",14,2,79,0.0909090909090909,7.181818181818182,0.5539241658790723,0.6086882307266724,0.46138390235850835
4,1,"Faithful John was his favourite servant, and was so called, because he had for his whole life long been so true to him.",26,5,279,0.0909090909090909,25.363636363636363,0.5539241658790723,0.6086882307266724,0.46138390235850835
4,1,"When therefore he came beside the bed, the King said to him, ""Most faithful John, I feel my end approaching, and have no anxiety except about my son.",34,4,471,0.0909090909090909,42.81818181818182,0.5539241658790723,0.6086882307266724,0.46138390235850835
4,1,"He is still of tender age, and cannot always know how to guide himself.",17,3,121,0.0909090909090909,11.0,0.5539241658790723,0.6086882307266724,0.46138390235850835
4,1,"If thou dost not promise me to teach him everything that he ought to know, and to be his foster-father, I cannot close my eyes in peace.""",32,6,466,0.0909090909090909,42.36363636363637,0.5539241658790723,0.6086882307266724,0.46138390235850835
4,1,"Then answered Faithful John, ""I will not forsake him, and will serve him with fidelity, even if it should cost me my life.""",29,4,379,0.0909090909090909,34.45454545454545,0.5539241658790723,0.6086882307266724,0.46138390235850835
4,1,"On this, the old King said, ""Now I die in comfort and peace.""",18,2,87,0.0909090909090909,7.909090909090909,0.5539241658790723,0.6086882307266724,0.46138390235850835
4,1,"Then he added, ""After my death, thou shalt show him the whole castle: all the chambers, halls, and vaults, and all the treasures which lie therein, but the last chamber in the long gallery, in which is the picture of the princess of the Golden Dwelling, shalt thou not show.",61,6,1714,0.0909090909090909,155.8181818181818,0.5539241658790723,0.6086882307266724,0.46138390235850835
4,1,"If he sees that picture, he will fall violently in love with her, and will drop down in a swoon, and go through great danger for her sake, therefore thou must preserve him from that.""",41,5,744,0.0909090909090909,67.63636363636364,0.5539241658790723,0.6086882307266724,0.46138390235850835
4,1,"And when Faithful John had once more given his promise to the old King about this, the King said no more, but laid his head on his pillow, and died.",34,5,445,0.0909090909090909,40.45454545454545,0.5539241658790723,0.6086882307266724,0.46138390235850835
4,2,"When the old King had been carried to his grave, Faithful John told the young King all that he had promised his father on his deathbed, and said, ""This will I assuredly perform, and will be faithful to thee as I have been faithful to him, even if it should cost me my life.""",62,13,1663,0.0833333333333333,138.58333333333331,0.5539241658790723,0.6086882307266724,0.46138390235850835
4,2,"When the mourning was over, Faithful John said to him, ""It is now time that thou shouldst see thine inheritance.",24,4,216,0.0833333333333333,18.0,0.5539241658790723,0.6086882307266724,0.46138390235850835
4,2,"I will show thee thy father's palace.""",10,1,31,0.0833333333333333,2.583333333333333,0.5539241658790723,0.6086882307266724,0.46138390235850835
4,2,"Then he took him about everywhere, up and down, and let him see all the riches, and the magnificent apartments, only there was one room which he did not open, that in which hung the dangerous picture.",43,7,823,0.0833333333333333,68.58333333333333,0.5539241658790723,0.6086882307266724,0.46138390235850835
4,2,"The picture was, however, so placed that when the door was opened you looked straight on it, and it was so admirably painted that it seemed to breathe and live, and there was nothing more charming or more beautiful in the whole world.",48,11,1038,0.0833333333333333,86.5,0.5539241658790723,0.6086882307266724,0.46138390235850835
4,2,"The young King, however, plainly remarked that Faithful John always walked past this one door, and said, ""Why dost thou never open this one for me?""",33,4,353,0.0833333333333333,29.416666666666664,0.5539241658790723,0.6086882307266724,0.46138390235850835
4,2,"- ""There is something within it,"" he replied, ""which would terrify thee.""",19,3,126,0.0833333333333333,10.5,0.5539241658790723,0.6086882307266724,0.46138390235850835
4,2,"But the King answered, ""I have seen all the palace, and I will know what is in this room also,"" and he went and tried to break open the door by force.",38,8,601,0.0833333333333333,50.08333333333333,0.5539241658790723,0.6086882307266724,0.46138390235850835
4,2,"Then Faithful John held him back and said, ""I promised thy father before his death that thou shouldst not see that which is in this chamber, it might bring the greatest misfortune on thee and on me.""",42,6,747,0.0833333333333333,62.25,0.5539241658790723,0.6086882307266724,0.46138390235850835
4,2,"- ""Ah, no,"" replied the young King, ""if I do not go in, it will be my certain destruction.",27,4,218,0.0833333333333333,18.166666666666664,0.5539241658790723,0.6086882307266724,0.46138390235850835
4,2,I should have no rest day or night until I had seen it with my own eyes.,18,3,123,0.0833333333333333,10.25,0.5539241658790723,0.6086882307266724,0.46138390235850835
4,2,"I shall not leave the place now until thou hast unlocked the door.""",15,2,72,0.0833333333333333,6.0,0.5539241658790723,0.6086882307266724,0.46138390235850835
4,3,"Then Faithful John saw that there was no help for it now, and with a heavy heart and many sighs, sought out the key from the great bunch.",31,3,384,0.0833333333333333,32.0,0.5539241658790723,0.6086882307266724,0.46138390235850835
4,3,"When he had opened the door, he went in first, and thought by standing before him he could hide the portrait so that the King should not see it in front of him, but what availed that?",41,8,744,0.0833333333333333,62.0,0.5539241658790723,0.6086882307266724,0.46138390235850835
4,3,The King stood on tip-toe and saw it over his shoulder.,12,2,48,0.0833333333333333,4.0,0.5539241658790723,0.6086882307266724,0.46138390235850835
4,3,"And when he saw the portrait of the maiden, which was so magnificent and shone with gold and precious stones, he fell fainting to the ground.",29,4,331,0.0833333333333333,27.58333333333333,0.5539241658790723,0.6086882307266724,0.46138390235850835
4,3,"Faithful John took him up, carried him to his bed, and sorrowfully thought, ""The misfortune has befallen us, Lord God, what will be the end of it?""",35,6,531,0.0833333333333333,44.25,0.5539241658790723,0.6086882307266724,0.46138390235850835
4,3,"Then he strengthened him with wine, until he came to himself again.",14,2,69,0.0833333333333333,5.75,0.5539241658790723,0.6086882307266724,0.46138390235850835
4,3,"The first words the King said were, ""Ah, the beautiful portrait!",15,2,60,0.0833333333333333,5.0,0.5539241658790723,0.6086882307266724,0.46138390235850835
4,3,"whose it it?""",5,1,10,0.0833333333333333,0.8333333333333333,0.5539241658790723,0.6086882307266724,0.46138390235850835
4,3,"- ""That is the princess of the Golden Dwelling,"" answered Faithful John.",16,2,84,0.0833333333333333,7.0,0.5539241658790723,0.6086882307266724,0.46138390235850835
4,3,"Then the King continued, ""My love for her is so great, that if all the leaves on all the trees were tongues, they could not declare it.",32,4,412,0.0833333333333333,34.33333333333333,0.5539241658790723,0.6086882307266724,0.46138390235850835
4,3,I will give my life to win her.,9,2,24,0.0833333333333333,2.0,0.5539241658790723,0.6086882307266724,0.46138390235850835
4,3,"Thou art my most Faithful John, thou must help me.""",13,2,67,0.0833333333333333,5.583333333333333,0.5539241658790723,0.6086882307266724,0.46138390235850835
4,4,"The faithful servant considered within himself for a long time how to set about the matter, for it was difficult even to obtain a sight of the King's daughter.",32,4,412,0.1666666666666666,68.66666666666666,0.5539241658790723,0.6086882307266724,0.46138390235850835
4,4,"At length he thought of a way, and said to the King, ""Everything which she has about her is of gold - tables, chairs, dishes, glasses, bowls, and household furniture.",39,4,636,0.1666666666666666,106.0,0.5539241658790723,0.6086882307266724,0.46138390235850835
4,4,"Among thy treasures are five tons of gold; let one of the goldsmiths of the Kingdom work these up into all manner of vessels and utensils, into all kinds of birds, wild beasts and strange animals, such as may please her, and we will go there with them and try our luck.""",59,4,1546,0.1666666666666666,257.66666666666663,0.5539241658790723,0.6086882307266724,0.46138390235850835
4,4,"The King ordered all the goldsmiths to be brought to him, and they had to work night and day until at last the most splendid things were prepared.",30,7,381,0.1666666666666666,63.5,0.5539241658790723,0.6086882307266724,0.46138390235850835
4,4,"When everything was stowed on board a ship, Faithful John put on the dress of a merchant, and the King was forced to do the same in order to make himself quite unrecognizable.",36,7,564,0.1666666666666666,94.0,0.5539241658790723,0.6086882307266724,0.46138390235850835
4,4,"Then they sailed across the sea, and sailed on until they came to the town wherein dwelt the princess of the Golden Dwelling.",25,4,256,0.1666666666666666,42.66666666666666,0.5539241658790723,0.6086882307266724,0.46138390235850835
4,5,"Faithful John bade the King stay behind on the ship, and wait for him.",16,1,94,0.0625,5.875,0.5539241658790723,0.6086882307266724,0.46138390235850835
4,5,"""Perhaps I shall bring the princess with me,"" said he, ""therefore see that everything is in order; have the golden vessels set out and the whole ship decorated.""",36,7,506,0.0625,31.625,0.5539241658790723,0.6086882307266724,0.46138390235850835
4,5,"Then he gathered together in his apron all kinds of gold things, went on shore and walked straight to the royal palace.",24,3,234,0.0625,14.625,0.5539241658790723,0.6086882307266724,0.46138390235850835
4,5,"When he entered the courtyard of the palace, a beautiful girl was standing there by the well with two golden buckets in her hand, drawing water with them.",31,4,409,0.0625,25.5625,0.5539241658790723,0.6086882307266724,0.46138390235850835
4,5,"And when she was just turning round to carry away the sparkling water she saw the stranger, and asked who he was.",24,6,216,0.0625,13.5,0.5539241658790723,0.6086882307266724,0.46138390235850835
4,5,"So he answered, ""I am a merchant,"" and opened his apron, and let her look in.",22,4,193,0.0625,12.0625,0.5539241658790723,0.6086882307266724,0.46138390235850835
4,5,"Then she cried, ""Oh, what beautiful gold things!""",13,1,58,0.0625,3.625,0.5539241658790723,0.6086882307266724,0.46138390235850835
4,5,and put her pails down and looked at the golden wares one after the other.,16,2,106,0.0625,6.625,0.5539241658790723,0.6086882307266724,0.46138390235850835
4,5,"Then said the girl, ""The princess must see these, she has such great pleasure in golden things, that she will buy all you have.""",30,5,407,0.0625,25.4375,0.5539241658790723,0.6086882307266724,0.46138390235850835
4,5,"She took him by the hand and led him upstairs, for she was the waiting-maid.",17,3,121,0.0625,7.5625,0.5539241658790723,0.6086882307266724,0.46138390235850835
4,5,"When the King's daughter saw the wares, she was quite delighted and said, ""They are so beautifully worked, that I will buy them all of thee.""",33,6,393,0.0625,24.5625,0.5539241658790723,0.6086882307266724,0.46138390235850835
4,5,"But Faithful John said, ""I am only the servant of a rich merchant.",16,2,84,0.0625,5.25,0.5539241658790723,0.6086882307266724,0.46138390235850835
4,5,The things I have here are not to be compared with those my master has in his ship.,19,5,126,0.0625,7.875,0.5539241658790723,0.6086882307266724,0.46138390235850835
4,5,"They are the most beautiful and valuable things that have ever been made in gold.""",17,4,121,0.0625,7.5625,0.5539241658790723,0.6086882307266724,0.46138390235850835
4,5,"She wanted to have everything brought to her there, but he said, ""There are so many of them that it would take a great many days to do that, and so many rooms would be required to exhibit them, that your house is not big enough.""",53,10,1327,0.0625,82.9375,0.5539241658790723,0.6086882307266724,0.46138390235850835
4,5,"Then her curiosity and longing were still more excited, until at last she said, ""Conduct me to the ship, I will go there myself, and behold the treasures of thine master.""",38,5,543,0.0625,33.9375,0.5539241658790723,0.6086882307266724,0.46138390235850835
4,6,"On this Faithful John was quite delighted, and led her to the ship, and when the King saw her, he perceived that her beauty was even greater than the picture had represented it to be, and thought no other than that his heart would burst in twain.",52,10,1138,0.0833333333333333,94.83333333333331,0.5539241658790723,0.6086882307266724,0.46138390235850835
4,6,"Then she got into the ship, and the King led her within.",14,2,69,0.0833333333333333,5.75,0.5539241658790723,0.6086882307266724,0.46138390235850835
4,6,"Faithful John, however, remained behind with the pilot, and ordered the ship to be pushed off, saying, ""Set all sail, till it fly like a bird in air.""",37,7,511,0.0833333333333333,42.58333333333333,0.5539241658790723,0.6086882307266724,0.46138390235850835
