tale_id,episode_id,sentence,num_words,num_clauses,dep_distance,Eventfulness,I,hurst_dep_distance,hurst_eventfulness,hurst_I
6,1,"The wolf obeyed, but the musician quickly picked up a stone and with one blow wedged his two paws so fast that he was forced to stay there like a prisoner.",33,6,468,0.0769230769230769,36.0,0.6005915072287779,0.7308851595140604,0.8130412616955572
6,1,"""Stay there until I come back again,"" said the musician, and went his way.",19,4,154,0.0769230769230769,11.846153846153848,0.6005915072287779,0.7308851595140604,0.8130412616955572
6,2,"After a while he again said to himself, ""Time is beginning to pass heavily with me here in the forest, I will fetch hither another companion,"" and took his fiddle and again played in the forest.",42,7,681,0.0625,42.5625,0.6005915072287779,0.7308851595140604,0.8130412616955572
6,2,It was not long before a fox came creeping through the trees towards him.,15,4,92,0.0625,5.75,0.6005915072287779,0.7308851595140604,0.8130412616955572
6,2,"""Ah, there's a fox coming!""",10,2,25,0.0625,1.5625,0.6005915072287779,0.7308851595140604,0.8130412616955572
6,2,said the musician.,4,1,6,0.0625,0.375,0.6005915072287779,0.7308851595140604,0.8130412616955572
6,2,"""I have no desire for him.""",9,1,24,0.0625,1.5,0.6005915072287779,0.7308851595140604,0.8130412616955572
6,2,"The fox came up to him and said, ""Oh, dear musician, how beautifully thou dost play!",21,3,174,0.0625,10.875,0.6005915072287779,0.7308851595140604,0.8130412616955572
6,2,"I should like to learn that too.""",9,2,24,0.0625,1.5,0.6005915072287779,0.7308851595140604,0.8130412616955572
6,2,"- ""That is soon learnt,"" said the musician.",12,2,42,0.0625,2.625,0.6005915072287779,0.7308851595140604,0.8130412616955572
6,2,"""Thou hast only to do everything that I bid thee.""",13,2,43,0.0625,2.6875,0.6005915072287779,0.7308851595140604,0.8130412616955572
6,2,"- ""Oh, musician,"" then said the fox, ""I will obey thee as a scholar obeys his master.""",25,2,172,0.0625,10.75,0.6005915072287779,0.7308851595140604,0.8130412616955572
6,2,"- ""Follow me,"" said the musician; and when they had walked a part of the way, they came to a footpath, with high bushes on both sides of it.",36,4,456,0.0625,28.5,0.6005915072287779,0.7308851595140604,0.8130412616955572
6,2,"There the musician stood still, and from one side bent a young hazel-bush down to the ground, and put his foot on the top of it, then he bent down a young tree from the other side as well, and said, ""Now little fox, if thou wilt learn something, give me thy left front paw.""",65,6,1897,0.0625,118.5625,0.6005915072287779,0.7308851595140604,0.8130412616955572
6,2,"The fox obeyed, and the musician fastened his paw to the left bough.",15,3,81,0.0625,5.0625,0.6005915072287779,0.7308851595140604,0.8130412616955572
6,2,"""Little fox,"" said he, ""now reach me thy right paw"" and he tied it to the right bough.",25,3,205,0.0625,12.8125,0.6005915072287779,0.7308851595140604,0.8130412616955572
6,2,"When he had examined whether they were firm enough, he let go, and the bushes sprang up again, and jerked up the little fox, so that it hung struggling in the air.",37,9,598,0.0625,37.375,0.6005915072287779,0.7308851595140604,0.8130412616955572
6,2,"""Wait there till I come back again,"" said the musician, and went his way.",19,4,126,0.0625,7.875,0.6005915072287779,0.7308851595140604,0.8130412616955572
6,3,"Again he said to himself, ""Time is beginning to pass heavily with me here in the forest, I will fetch hither another companion,"" so he took his fiddle, and the sound echoed through the forest.",42,7,783,0.0909090909090909,71.18181818181819,0.6005915072287779,0.7308851595140604,0.8130412616955572
6,3,Then a little hare came springing towards him.,9,2,20,0.0909090909090909,1.8181818181818183,0.6005915072287779,0.7308851595140604,0.8130412616955572
6,3,"""Why, a hare is coming,"" said the musician, ""I do not want him.""",21,5,135,0.0909090909090909,12.272727272727272,0.6005915072287779,0.7308851595140604,0.8130412616955572
6,3,"- ""Ah, dear musician,"" said the hare, ""how beautifully thou dost fiddle; I too, should like to learn that.""",29,4,246,0.0909090909090909,22.363636363636363,0.6005915072287779,0.7308851595140604,0.8130412616955572
6,3,"- ""That is soon learnt,"" said the musician, ""thou hast only to do everything that I bid thee.""",25,4,237,0.0909090909090909,21.545454545454547,0.6005915072287779,0.7308851595140604,0.8130412616955572
6,3,"- ""Oh, musician,"" replied the little hare, ""I will obey thee as a scholar obeys his master.""",25,2,181,0.0909090909090909,16.454545454545453,0.6005915072287779,0.7308851595140604,0.8130412616955572
6,3,"They went a part of the way together until they came to an open space in the forest, where stood an aspen tree.",25,3,277,0.0909090909090909,25.181818181818183,0.6005915072287779,0.7308851595140604,0.8130412616955572
6,3,"The musician tied a long string round the little hare's neck, the other end of which he fastened to the tree.",24,3,234,0.0909090909090909,21.272727272727277,0.6005915072287779,0.7308851595140604,0.8130412616955572
6,3,"""Now briskly, little hare, run twenty times round the tree!""",15,2,56,0.0909090909090909,5.090909090909091,0.6005915072287779,0.7308851595140604,0.8130412616955572
6,3,"cried the musician, and the little hare obeyed, and when it had run round twenty times, it had twisted the string twenty times round the trunk of the tree, and the little hare was caught, and let it pull and tug as it liked, it only made the string cut into its tender neck.",61,14,1830,0.0909090909090909,166.36363636363637,0.6005915072287779,0.7308851595140604,0.8130412616955572
6,3,"""Wait there till I come back,"" said the musician, and went onwards.",17,4,97,0.0909090909090909,8.818181818181818,0.6005915072287779,0.7308851595140604,0.8130412616955572
6,4,"The wolf, in the meantime, had pushed and pulled and bitten at the stone, and had worked so long that he had set his feet at liberty and had drawn them once more out of the cleft.",41,10,589,0.2,117.8,0.6005915072287779,0.7308851595140604,0.8130412616955572
6,4,Full of anger and rage he hurried after the musician and wanted to tear him to pieces.,18,3,87,0.2,17.400000000000002,0.6005915072287779,0.7308851595140604,0.8130412616955572
6,4,"When the fox saw him running, he began to lament, and cried with all his might, ""Brother wolf, come to my help, the musician has betrayed me!""",35,8,502,0.2,100.4,0.6005915072287779,0.7308851595140604,0.8130412616955572
6,4,"The wolf drew down the little tree, bit the cord in two, and freed the fox, who went with him to take revenge on the musician.",30,5,381,0.2,76.2,0.6005915072287779,0.7308851595140604,0.8130412616955572
6,4,"They found the tied-up hare, whom likewise they delivered, and then they all sought the enemy together.",20,4,172,0.2,34.4,0.6005915072287779,0.7308851595140604,0.8130412616955572
6,5,"The musician had once more played his fiddle as he went on his way, and this time he had been more fortunate.",24,5,234,0.125,29.25,0.6005915072287779,0.7308851595140604,0.8130412616955572
6,5,"The sound reached the ears of a poor wood-cutter, who instantly, whether he would or no, gave up his work and came with his hatchet under his arm to listen to the music.",37,4,598,0.125,74.75,0.6005915072287779,0.7308851595140604,0.8130412616955572
6,5,"""At last comes the right companion,"" said the musician, ""for I was seeking a human being, and no wild beast.""",28,5,306,0.125,38.25,0.6005915072287779,0.7308851595140604,0.8130412616955572
6,5,"And he began and played so beautifully and delightfully that the poor man stood there as if bewitched, and his heart leaped with gladness.",26,5,279,0.125,34.875,0.6005915072287779,0.7308851595140604,0.8130412616955572
6,5,"And as he thus stood, the wolf, the fox, and the hare came up, and he saw well that they had some evil design.",29,4,310,0.125,38.75,0.6005915072287779,0.7308851595140604,0.8130412616955572
6,5,"So he raised his glittering axe and placed himself before the musician, as if to say, ""Whoso wishes to touch him let him beware, for he will have to do with me!""",38,9,633,0.125,79.125,0.6005915072287779,0.7308851595140604,0.8130412616955572
6,5,Then the beasts were terrified and ran back into the forest.,12,3,42,0.125,5.25,0.6005915072287779,0.7308851595140604,0.8130412616955572
6,5,"The musician, however, played once more to the man out of gratitude, and then went onwards.",20,2,120,0.125,15.0,0.6005915072287779,0.7308851595140604,0.8130412616955572
7,1,"A cat had made the acquaintance of a mouse, and had said so much to her about the great love and friendship that he felt for her, that at last the mouse agreed that they should live and keep house together.",44,8,864,0.0333333333333333,28.8,0.5999987813365052,0.8405413133421109,0.6368619319185901
7,1,"""But we must make preparations for winter, or else we shall suffer from hunger,"" said the cat, ""and you, little mouse, cannot venture out everywhere, or in the end you will be caught in a trap.""",48,5,956,0.0333333333333333,31.866666666666667,0.5999987813365052,0.8405413133421109,0.6368619319185901
7,1,"This good advice was followed, and they bought a pot of fat, but they did not know where to store it.",24,6,216,0.0333333333333333,7.2,0.5999987813365052,0.8405413133421109,0.6368619319185901
7,1,"Finally, after much consideration, the cat said, ""I know of no place where it will be better stored up than in the church.",28,4,226,0.0333333333333333,7.533333333333333,0.5999987813365052,0.8405413133421109,0.6368619319185901
7,1,No one dares take anything away from there.,9,2,24,0.0333333333333333,0.8,0.5999987813365052,0.8405413133421109,0.6368619319185901
7,1,"We will put it beneath the altar, and not touch it until we are need it.""",19,3,139,0.0333333333333333,4.633333333333333,0.5999987813365052,0.8405413133421109,0.6368619319185901
7,1,"So the pot was stored safely away, but it was not long before the cat took a great longing for it, and said to the mouse, ""I wanted to tell you, little mouse, that my cousin has brought a little son into the world, and she has asked me to be his godfather.",61,12,1659,0.0333333333333333,55.3,0.5999987813365052,0.8405413133421109,0.6368619319185901
7,1,"He is white with brown spots, and I am to hold him over the baptismal font.",18,3,137,0.0333333333333333,4.566666666666666,0.5999987813365052,0.8405413133421109,0.6368619319185901
7,1,"Let me go out today, and you look after the house by yourself.""",16,3,120,0.0333333333333333,4.0,0.5999987813365052,0.8405413133421109,0.6368619319185901
7,1,"- ""Yes, yes,"" answered the mouse.",11,1,34,0.0333333333333333,1.1333333333333333,0.5999987813365052,0.8405413133421109,0.6368619319185901
7,1,"""By all means go, and if you get anything good to eat, think of me.",19,3,115,0.0333333333333333,3.8333333333333335,0.5999987813365052,0.8405413133421109,0.6368619319185901
7,1,"I would like to drink a drop of sweet red christening wine myself.""",15,2,81,0.0333333333333333,2.7,0.5999987813365052,0.8405413133421109,0.6368619319185901
7,1,"All this, however, was untrue.",8,1,18,0.0333333333333333,0.6,0.5999987813365052,0.8405413133421109,0.6368619319185901
7,1,"The cat had no cousin, and had not been asked to be godfather.",15,5,81,0.0333333333333333,2.7,0.5999987813365052,0.8405413133421109,0.6368619319185901
7,1,"He went straight to the church, crept up to the pot of fat, began to lick at it, and licked off the top of the fat.",30,5,407,0.0333333333333333,13.566666666666666,0.5999987813365052,0.8405413133421109,0.6368619319185901
7,1,"Then he went for a stroll on the roofs of the town, looked out for opportunities, and then stretched out in the sun, licking his whiskers whenever he thought of the pot of fat.",38,5,633,0.0333333333333333,21.1,0.5999987813365052,0.8405413133421109,0.6368619319185901
7,1,He did not return home until it was evening.,10,4,37,0.0333333333333333,1.2333333333333334,0.5999987813365052,0.8405413133421109,0.6368619319185901
7,1,"""Well, here you are again,"" said the mouse.",13,2,43,0.0333333333333333,1.4333333333333331,0.5999987813365052,0.8405413133421109,0.6368619319185901
7,1,"""You must have had a happy day.""",10,2,27,0.0333333333333333,0.9,0.5999987813365052,0.8405413133421109,0.6368619319185901
7,1,"- ""Everything went well,"" answered the cat.",11,2,34,0.0333333333333333,1.1333333333333333,0.5999987813365052,0.8405413133421109,0.6368619319185901
7,1,"""What name did they give the child?""",10,2,27,0.0333333333333333,0.9,0.5999987813365052,0.8405413133421109,0.6368619319185901
7,1,asked the mouse.,4,1,6,0.0333333333333333,0.2,0.5999987813365052,0.8405413133421109,0.6368619319185901
7,1,"""Top-Off,"" said the cat quite coolly.",10,1,25,0.0333333333333333,0.8333333333333334,0.5999987813365052,0.8405413133421109,0.6368619319185901
7,1,"""Top-Off?""",4,1,6,0.0333333333333333,0.2,0.5999987813365052,0.8405413133421109,0.6368619319185901
7,1,cried the mouse.,4,1,6,0.0333333333333333,0.2,0.5999987813365052,0.8405413133421109,0.6368619319185901
7,1,"""That is a very odd and uncommon name.",10,1,31,0.0333333333333333,1.0333333333333332,0.5999987813365052,0.8405413133421109,0.6368619319185901
7,1,"Is it a usual one in your family?""",10,1,45,0.0333333333333333,1.5,0.5999987813365052,0.8405413133421109,0.6368619319185901
7,1,"- ""What does that matter?""",8,1,16,0.0333333333333333,0.5333333333333333,0.5999987813365052,0.8405413133421109,0.6368619319185901
7,1,said the cat.,4,1,6,0.0333333333333333,0.2,0.5999987813365052,0.8405413133421109,0.6368619319185901
7,1,"""It is no worse than Crumb-Thief, as your godchildren are called.""",15,3,81,0.0333333333333333,2.7,0.5999987813365052,0.8405413133421109,0.6368619319185901
7,2,Before long the cat was seized by another fit of longing.,12,2,38,0.0833333333333333,3.1666666666666665,0.5999987813365052,0.8405413133421109,0.6368619319185901
7,2,"He said to the mouse, ""You must do me a favor, and once more manage the house alone for a day.",25,2,277,0.0833333333333333,23.08333333333333,0.5999987813365052,0.8405413133421109,0.6368619319185901
7,2,"I have been asked again to be godfather, and since the child has a white ring around its neck, I cannot refuse.""",27,6,326,0.0833333333333333,27.166666666666664,0.5999987813365052,0.8405413133421109,0.6368619319185901
7,2,The good mouse consented.,5,1,7,0.0833333333333333,0.5833333333333333,0.5999987813365052,0.8405413133421109,0.6368619319185901
7,2,"However, the cat crept behind the town wall to the church, and devoured half the pot of fat.",21,1,126,0.0833333333333333,10.5,0.5999987813365052,0.8405413133421109,0.6368619319185901
7,2,"""Nothing tastes as good as that which one eats by oneself,"" he said, and was quite satisfied with his day's work.",27,2,186,0.0833333333333333,15.5,0.5999987813365052,0.8405413133421109,0.6368619319185901
7,2,"When he arrived home the mouse asked, ""What name was this child christened with?""",18,4,123,0.0833333333333333,10.25,0.5999987813365052,0.8405413133421109,0.6368619319185901
7,2,"- ""Half-Gone,"" answered the cat.",9,1,21,0.0833333333333333,1.75,0.5999987813365052,0.8405413133421109,0.6368619319185901
7,2,"""Half-Gone?",3,1,3,0.0833333333333333,0.25,0.5999987813365052,0.8405413133421109,0.6368619319185901
7,2,What are you saying?,5,2,7,0.0833333333333333,0.5833333333333333,0.5999987813365052,0.8405413133421109,0.6368619319185901
7,2,I have never heard that name in all my life.,11,2,46,0.0833333333333333,3.833333333333333,0.5999987813365052,0.8405413133421109,0.6368619319185901
7,2,"I'll wager it is not in the almanac.""",11,2,39,0.0833333333333333,3.25,0.5999987813365052,0.8405413133421109,0.6368619319185901
7,3,The cat's mouth soon again began to water for the delicious goods.,14,1,49,0.0416666666666666,2.0416666666666665,0.5999987813365052,0.8405413133421109,0.6368619319185901
7,3,"""All good things come in threes,"" he said to the mouse.",15,2,65,0.0416666666666666,2.708333333333333,0.5999987813365052,0.8405413133421109,0.6368619319185901
7,3,"""I have been asked to be godfather again.",10,4,31,0.0416666666666666,1.2916666666666663,0.5999987813365052,0.8405413133421109,0.6368619319185901
7,3,"The child is totally black, only it has white paws.",12,2,48,0.0416666666666666,2.0,0.5999987813365052,0.8405413133421109,0.6368619319185901
7,3,Otherwise it has not a single white hair on its whole body.,13,1,58,0.0416666666666666,2.4166666666666665,0.5999987813365052,0.8405413133421109,0.6368619319185901
7,3,This only happens once every few years.,8,1,18,0.0416666666666666,0.75,0.5999987813365052,0.8405413133421109,0.6368619319185901
7,3,"You will let me go, won't you?""",11,2,39,0.0416666666666666,1.625,0.5999987813365052,0.8405413133421109,0.6368619319185901
7,3,"- ""Top-Off.",4,1,6,0.0416666666666666,0.25,0.5999987813365052,0.8405413133421109,0.6368619319185901
7,3,"Half-Gone,"" answered the mouse.",7,1,12,0.0416666666666666,0.5,0.5999987813365052,0.8405413133421109,0.6368619319185901
7,3,"""They are such odd names, that they make me stop and think.""",16,4,94,0.0416666666666666,3.9166666666666665,0.5999987813365052,0.8405413133421109,0.6368619319185901
7,3,"- ""Here you sit at home,"" said the cat, ""with your dark gray fur coat and long braid of hair capturing fantasies.",28,3,286,0.0416666666666666,11.916666666666666,0.5999987813365052,0.8405413133421109,0.6368619319185901
7,3,"That is because you do not go out in the daytime.""",13,3,67,0.0416666666666666,2.7916666666666665,0.5999987813365052,0.8405413133421109,0.6368619319185901
7,3,"During the cat's absence the mouse cleaned the house, and put it in order, but the greedy cat devoured all the rest of the fat.",29,3,259,0.0416666666666666,10.791666666666666,0.5999987813365052,0.8405413133421109,0.6368619319185901
7,3,"""One has peace only after everything is eaten up,"" he said to himself.",17,4,108,0.0416666666666666,4.5,0.5999987813365052,0.8405413133421109,0.6368619319185901
7,3,"Well filled and fat, he did not return home until nighttime.",13,3,67,0.0416666666666666,2.7916666666666665,0.5999987813365052,0.8405413133421109,0.6368619319185901
7,3,The mouse immediately asked what name had been given to the third child.,14,4,61,0.0416666666666666,2.5416666666666665,0.5999987813365052,0.8405413133421109,0.6368619319185901
7,3,"""You will not like it either,"" said the cat.",13,2,46,0.0416666666666666,1.9166666666666663,0.5999987813365052,0.8405413133421109,0.6368619319185901
7,3,"""His name is All-Gone.""",7,1,12,0.0416666666666666,0.5,0.5999987813365052,0.8405413133421109,0.6368619319185901
7,3,"- ""All-Gone!,"" cried the mouse.",10,1,27,0.0416666666666666,1.125,0.5999987813365052,0.8405413133421109,0.6368619319185901
7,3,"""That is the most worrisome name of all.",10,1,31,0.0416666666666666,1.2916666666666663,0.5999987813365052,0.8405413133421109,0.6368619319185901
7,3,I have never seen it in print.,8,2,22,0.0416666666666666,0.9166666666666666,0.5999987813365052,0.8405413133421109,0.6368619319185901
7,3,All-Gone!,2,1,1,0.0416666666666666,0.0416666666666666,0.5999987813365052,0.8405413133421109,0.6368619319185901
7,3,"What can that mean?""",6,1,9,0.0416666666666666,0.375,0.5999987813365052,0.8405413133421109,0.6368619319185901
7,3,"Then she shook her head, curled herself up, and lay down to sleep.",16,4,94,0.0416666666666666,3.9166666666666665,0.5999987813365052,0.8405413133421109,0.6368619319185901
7,4,"From this time forth no one invited the cat to be godfather, but when winter had come and there was no longer anything to be found outside, the mouse thought of their stored food, and said, ""Come cat, we will go to our pot of fat which we have stored up for ourselves.",60,13,1602,0.0666666666666666,106.8,0.5999987813365052,0.8405413133421109,0.6368619319185901
7,4,"It will taste good now.""",7,1,13,0.0666666666666666,0.8666666666666667,0.5999987813365052,0.8405413133421109,0.6368619319185901
7,4,"- ""Yes,"" answered the cat.",9,1,21,0.0666666666666666,1.4,0.5999987813365052,0.8405413133421109,0.6368619319185901
7,4,"""You will enjoy it as much as you would enjoy sticking that dainty tongue of yours out of the window.""",23,3,196,0.0666666666666666,13.066666666666666,0.5999987813365052,0.8405413133421109,0.6368619319185901
7,4,"They set out on their way, but when they arrived, the pot of fat, to be sure, was still in its place, but it was empty.",32,5,466,0.0666666666666666,31.066666666666663,0.5999987813365052,0.8405413133421109,0.6368619319185901
7,4,"""Alas,"" said the mouse, ""now I see what has happened.",16,4,76,0.0666666666666666,5.066666666666666,0.5999987813365052,0.8405413133421109,0.6368619319185901
7,4,Now it comes to light.,6,1,9,0.0666666666666666,0.6,0.5999987813365052,0.8405413133421109,0.6368619319185901
7,4,You are a true friend.,6,1,11,0.0666666666666666,0.7333333333333333,0.5999987813365052,0.8405413133421109,0.6368619319185901
7,4,You ate everything when you were serving as a godfather.,11,3,46,0.0666666666666666,3.0666666666666664,0.5999987813365052,0.8405413133421109,0.6368619319185901
7,4,"First top off, then half done, then..."" - ""Be quiet!""",17,3,121,0.0666666666666666,8.066666666666666,0.5999987813365052,0.8405413133421109,0.6368619319185901
7,4,cried the cat.,4,1,6,0.0666666666666666,0.4,0.5999987813365052,0.8405413133421109,0.6368619319185901
7,4,"""One more word, and I will eat you too.""",13,1,46,0.0666666666666666,3.0666666666666664,0.5999987813365052,0.8405413133421109,0.6368619319185901
7,4,"""All gone,"" was already on the poor mouse's lips.",14,2,69,0.0666666666666666,4.6,0.5999987813365052,0.8405413133421109,0.6368619319185901
7,4,"She had scarcely spoken it before the cat sprang on her, seized her, and swallowed her down.",20,4,172,0.0666666666666666,11.466666666666669,0.5999987813365052,0.8405413133421109,0.6368619319185901
7,4,"You see, that is the way of the world.",11,2,46,0.0666666666666666,3.0666666666666664,0.5999987813365052,0.8405413133421109,0.6368619319185901
8,1,"There was once a man, whose wife was dead, and a woman, whose husband was dead; and the man had a daughter, and so had the woman.",33,5,497,0.25,124.25,0.5316213200766143,0.7739254518630527,0.837474106658393
8,1,"The girls were acquainted with each other, and used to play together sometimes in the woman's house.",20,4,156,0.25,39.0,0.5316213200766143,0.7739254518630527,0.837474106658393
8,1,"So the woman said to the man's daughter, ""Listen to me, tell your father that I will marry him, and then you shall have milk to wash in every morning and wine to drink, and my daughter shall have water to wash in and water to drink.""",55,10,1332,0.25,333.0,0.5316213200766143,0.7739254518630527,0.837474106658393
8,1,The girl went home and told her father what the woman had said.,14,4,69,0.25,17.25,0.5316213200766143,0.7739254518630527,0.837474106658393
8,2,"The man said, ""What shall I do!",10,2,31,0.25,7.75,0.5316213200766143,0.7739254518630527,0.837474106658393
8,2,"Marriage is a joy, and also a torment.""",11,1,46,0.25,11.5,0.5316213200766143,0.7739254518630527,0.837474106658393
8,2,"At last, as he could come to no conclusion, he took off his boot, and said to his daughter, ""Take this boot, it has a hole in the sole; go up with it into the loft, hang it on the big nail and pour water in it.",56,7,1246,0.25,311.5,0.5316213200766143,0.7739254518630527,0.837474106658393
8,2,"If it holds water, I will once more take to me a wife; if it lets out the water, so will I not.""",28,2,328,0.25,82.0,0.5316213200766143,0.7739254518630527,0.837474106658393
8,3,"The girl did as she was told, but the water held the hole together, and the boot was full up to the top.",26,5,279,0.3333333333333333,93.0,0.5316213200766143,0.7739254518630527,0.837474106658393
8,3,So she went and told her father how it was.,11,3,39,0.3333333333333333,13.0,0.5316213200766143,0.7739254518630527,0.837474106658393
8,3,"And he went up to see with his own eyes, and as there was no mistake about it, he went to the widow and courted her, and then they had the wedding.",36,6,564,0.3333333333333333,188.0,0.5316213200766143,0.7739254518630527,0.837474106658393
8,4,"The next morning, when the two girls awoke, there stood by the bedside of the man's daughter milk to wash in and wine to drink, and by the bedside of the woman's daughter there stood water to wash in and water to drink.",49,7,769,0.2,153.8,0.5316213200766143,0.7739254518630527,0.837474106658393
8,4,On the second morning there stood water to wash in and water to drink for both of them alike.,20,3,120,0.2,24.0,0.5316213200766143,0.7739254518630527,0.837474106658393
8,4,"On the third morning there stood water to wash in and water to drink for the man's daughter, and milk to wash in and wine to drink for the woman's daughter; and so it remained ever after.",42,7,681,0.2,136.20000000000002,0.5316213200766143,0.7739254518630527,0.837474106658393
8,4,"The woman hated her stepdaughter, and never knew how to treat her badly enough from one day to another.",21,3,174,0.2,34.800000000000004,0.5316213200766143,0.7739254518630527,0.837474106658393
8,4,"And she was jealous because her stepdaughter was pleasant and pretty, and her real daughter was ugly and hateful.",21,3,174,0.2,34.800000000000004,0.5316213200766143,0.7739254518630527,0.837474106658393
8,5,"Once in winter, when it was freezing hard, and snow lay deep on hill and valley, the woman made a frock out of paper, called her stepdaughter, and said, ""Here, put on this frock, go out into the wood and fetch me a basket of strawberries; I have a great wish for some.""",65,9,1732,0.1428571428571428,247.42857142857144,0.5316213200766143,0.7739254518630527,0.837474106658393
8,5,"""Oh dear,"" said the girl, ""there are no strawberries to be found in winter; the ground is frozen, and the snow covers everything.",31,5,340,0.1428571428571428,48.57142857142857,0.5316213200766143,0.7739254518630527,0.837474106658393
